{
  "schema": "intyy.intervention/1.0",
  "run_id": "run_2026-10-01_x5zb8h8hme",
  "tenant": "keystone",
  "capability": "kvfcu/open_share_subaccount",
  "kind": "approval",
  "reason": "discovery_irreversible",
  "step": {
    "id": "t10",
    "intent": null
  },
  "trouble": null,
  "ladder": [],
  "commit": {
    "state": "none",
    "notice": null
  },
  "operator_note": null,
  "approval": {
    "words": "Submit",
    "risk": "irreversible",
    "authorization": "none",
    "action": "click",
    "rule": "risk.needs_approval",
    "path": "/main.do",
    "detail": null
  },
  "screenshot": "screens/00046_observation.png",
  "decisions": [
    "approve_irreversible",
    "approve_reversible",
    "approve_idempotent",
    "decline"
  ],
  "outcomes": [],
  "deadline": "2026-10-01T21:21:58.737Z",
  "lease": null,
  "on_handback": null,
  "opened_at": "2026-10-01T20:51:58.737Z"
}
