{
  "schema": "intyy.intervention/1.0",
  "run_id": "run_2026-10-01_wg4rb47ksk",
  "tenant": "keystone",
  "capability": "kvfcu/open_share_subaccount",
  "kind": "approval",
  "reason": "no_authorization",
  "step": {
    "id": "click_ok",
    "intent": "Confirm the dialog to proceed with opening the sub-account."
  },
  "trouble": null,
  "ladder": [],
  "commit": {
    "state": "none",
    "notice": null
  },
  "operator_note": null,
  "approval": {
    "words": null,
    "risk": "irreversible",
    "authorization": "none"
  },
  "screenshot": null,
  "decisions": [
    "approved",
    "declined"
  ],
  "outcomes": [],
  "deadline": "2026-10-01T22:57:37.235Z",
  "lease": null,
  "on_handback": null,
  "opened_at": "2026-10-01T22:27:37.235Z"
}
