{
  "schema": "intyy.intervention/1.0",
  "run_id": "run_2026-10-01_5650nh2gzc",
  "tenant": "keystone",
  "capability": "kvfcu/open_share_subaccount",
  "kind": "start_confirmation",
  "reason": "supervised_mode",
  "step": {
    "id": "start",
    "intent": null
  },
  "trouble": null,
  "ladder": [],
  "commit": {
    "state": "none",
    "notice": null
  },
  "operator_note": null,
  "approval": null,
  "screenshot": null,
  "decisions": [
    "approved",
    "declined"
  ],
  "outcomes": [],
  "deadline": "2026-10-01T22:45:48.669Z",
  "lease": null,
  "on_handback": null,
  "opened_at": "2026-10-01T22:30:48.669Z"
}
